{
  "contacts": [
    {
      "a": "A",
      "axis": "horizontal_x",
      "b": "B",
      "id": "contact-AB",
      "point_a": [0.655273, 0.416667, 0.11],
      "point_b": [0.655273, 0.416667, 0.11]
    }
  ],
  "format": "kymaean.hero.method02.stage6m/1",
  "instrumentation": {"base_gray": 184, "outline_gray": 150, "outline_width": 0.6, "side_delta": -12, "top_delta": 12},
  "projection": {"depth_dx": 0.035, "depth_dy": 0.025, "mode": "fixed_orthographic_oblique"},
  "proxy_volumes": [
    {"density":"uniform","id":"A","solids":[
      {"id":"A-left-foot","polygon":[[0.540365,0.708333],[0.572917,0.708333],[0.572917,0.729167],[0.540365,0.729167]],"support_contact":true,"z0":0.05,"z1":0.16},
      {"id":"A-right-foot","polygon":[[0.611979,0.708333],[0.644531,0.708333],[0.644531,0.729167],[0.611979,0.729167]],"support_contact":true,"z0":0.05,"z1":0.16},
      {"id":"A-left-leg","polygon":[[0.566478,0.552083],[0.589264,0.552083],[0.576243,0.708333],[0.550202,0.708333]],"z0":0.07,"z1":0.15},
      {"id":"A-right-leg","polygon":[[0.59252,0.552083],[0.615306,0.552083],[0.621816,0.708333],[0.602285,0.708333]],"z0":0.07,"z1":0.15},
      {"id":"A-pelvis","polygon":[[0.556712,0.510417],[0.621816,0.510417],[0.615306,0.552083],[0.566478,0.552083]],"z0":0.07,"z1":0.15},
      {"id":"A-torso","polygon":[[0.543691,0.359375],[0.628327,0.359375],[0.655273,0.401042],[0.655273,0.432292],[0.621816,0.510417],[0.556712,0.510417],[0.537181,0.416667]],"z0":0.07,"z1":0.15},
      {"id":"A-head","polygon":[[0.579499,0.359375],[0.572988,0.333333],[0.569733,0.286458],[0.579499,0.25],[0.602285,0.239583],[0.618561,0.260417],[0.621816,0.3125],[0.615306,0.359375]],"z0":0.08,"z1":0.14}
    ]},
    {"density":"uniform","id":"B","solids":[
      {"id":"B-left-foot-a","polygon":[[0.69987,0.6875],[0.70638,0.6875],[0.70638,0.729167],[0.69987,0.730267]],"support_contact":true,"z0":0.05,"z1":0.16},
      {"id":"B-left-foot-b","polygon":[[0.70638,0.6875],[0.712891,0.6875],[0.712891,0.725866],[0.70638,0.729167]],"support_contact":true,"z0":0.05,"z1":0.16},
      {"id":"B-right-foot-a","polygon":[[0.735677,0.666667],[0.742188,0.666667],[0.742188,0.708333],[0.735677,0.710827]],"support_contact":true,"z0":0.05,"z1":0.16},
      {"id":"B-right-foot-b","polygon":[[0.742188,0.666667],[0.748698,0.666667],[0.748698,0.709135],[0.742188,0.708333]],"support_contact":true,"z0":0.05,"z1":0.16},
      {"id":"B-left-leg","polygon":[[0.677083,0.552083],[0.69987,0.552083],[0.709635,0.6875],[0.701823,0.6875]],"z0":0.07,"z1":0.15},
      {"id":"B-right-leg","polygon":[[0.70638,0.552083],[0.725911,0.552083],[0.745443,0.666667],[0.73763,0.666667]],"z0":0.07,"z1":0.15},
      {"id":"B-pelvis","polygon":[[0.657552,0.520833],[0.693359,0.520833],[0.716146,0.552083],[0.677083,0.552083]],"z0":0.07,"z1":0.15},
      {"id":"B-torso","polygon":[[0.655273,0.401042],[0.66276,0.359375],[0.688802,0.359375],[0.703125,0.489583],[0.693359,0.520833],[0.657552,0.520833],[0.655273,0.432292]],"z0":0.07,"z1":0.15},
      {"id":"B-head","polygon":[[0.66276,0.359375],[0.65625,0.328125],[0.65625,0.28125],[0.664062,0.25],[0.680339,0.239583],[0.693359,0.260417],[0.696615,0.307292],[0.688802,0.359375]],"z0":0.08,"z1":0.14}
    ]}
  ],
  "review": {"maquette_leakage":"PASS","surface_read":"PASS","transfer_eligible":true},
  "sanitization": {"allow_guides":false,"allow_ids":false,"allow_metadata":false,"allow_text":false,"transparent_background":true},
  "source_artboard": {"height":960,"width":1536},
  "static_cases": [
    {"contact_id":null,"counterparty":null,"expected":"stable","id":"A-unsupported","kind":"unsupported","minimum_margin":0.05,"proxy":"A","target_cop_x":null},
    {"contact_id":null,"counterparty":null,"expected":"unstable","id":"B-unsupported","kind":"unsupported","minimum_margin":0.009766,"proxy":"B","target_cop_x":null},
    {"contact_id":"contact-AB","counterparty":"A","expected":"stable","id":"B-supported-by-A","kind":"supported_pair","minimum_margin":0.0065,"proxy":"B","target_cop_x":0.70638}
  ],
  "surface_volumes":[{"id":"shared-surface","solids":[
    {"id":"surface-01","polygon":[[0.423177,0.729167],[0.540365,0.729167],[0.540365,0.7625],[0.423177,0.7625]],"z0":0.02,"z1":0.2},
    {"id":"surface-02","polygon":[[0.540365,0.729167],[0.572917,0.729167],[0.572917,0.7625],[0.540365,0.7625]],"z0":0.02,"z1":0.2},
    {"id":"surface-03","polygon":[[0.572917,0.729167],[0.611979,0.729167],[0.611979,0.7625],[0.572917,0.7625]],"z0":0.02,"z1":0.2},
    {"id":"surface-04","polygon":[[0.611979,0.729167],[0.644531,0.729167],[0.644531,0.7625],[0.611979,0.7625]],"z0":0.02,"z1":0.2},
    {"id":"surface-05","polygon":[[0.644531,0.729167],[0.651042,0.729167],[0.651042,0.7625],[0.644531,0.7625]],"z0":0.02,"z1":0.2},
    {"id":"surface-06","polygon":[[0.651042,0.729167],[0.668815,0.729792],[0.668815,0.763125],[0.651042,0.7625]],"z0":0.02,"z1":0.2},
    {"id":"surface-07","polygon":[[0.668815,0.729792],[0.683594,0.730729],[0.683594,0.764062],[0.668815,0.763125]],"z0":0.02,"z1":0.2},
    {"id":"surface-08","polygon":[[0.683594,0.730729],[0.695898,0.730938],[0.695898,0.764271],[0.683594,0.764062]],"z0":0.02,"z1":0.2},
    {"id":"surface-09","polygon":[[0.695898,0.730938],[0.69987,0.730267],[0.69987,0.7636],[0.695898,0.764271]],"z0":0.02,"z1":0.2},
    {"id":"surface-10","polygon":[[0.69987,0.730267],[0.70638,0.729167],[0.70638,0.7625],[0.69987,0.7636]],"z0":0.02,"z1":0.2},
    {"id":"surface-11","polygon":[[0.70638,0.729167],[0.712891,0.725866],[0.712891,0.759199],[0.70638,0.7625]],"z0":0.02,"z1":0.2},
    {"id":"surface-12","polygon":[[0.712891,0.725866],[0.715625,0.724479],[0.715625,0.757812],[0.712891,0.759199]],"z0":0.02,"z1":0.2},
    {"id":"surface-13","polygon":[[0.715625,0.724479],[0.724284,0.717917],[0.724284,0.75125],[0.715625,0.757812]],"z0":0.02,"z1":0.2},
    {"id":"surface-14","polygon":[[0.724284,0.717917],[0.732943,0.711875],[0.732943,0.745208],[0.724284,0.75125]],"z0":0.02,"z1":0.2},
    {"id":"surface-15","polygon":[[0.732943,0.711875],[0.735677,0.710827],[0.735677,0.744161],[0.732943,0.745208]],"z0":0.02,"z1":0.2},
    {"id":"surface-16","polygon":[[0.735677,0.710827],[0.742188,0.708333],[0.742188,0.741667],[0.735677,0.744161]],"z0":0.02,"z1":0.2},
    {"id":"surface-17","polygon":[[0.742188,0.708333],[0.748698,0.709135],[0.748698,0.742468],[0.742188,0.741667]],"z0":0.02,"z1":0.2},
    {"id":"surface-18","polygon":[[0.748698,0.709135],[0.758268,0.710313],[0.758268,0.743646],[0.748698,0.742468]],"z0":0.02,"z1":0.2},
    {"id":"surface-19","polygon":[[0.758268,0.710313],[0.775521,0.717604],[0.775521,0.750937],[0.758268,0.743646]],"z0":0.02,"z1":0.2},
    {"id":"surface-20","polygon":[[0.775521,0.717604],[0.791602,0.725521],[0.791602,0.758854],[0.775521,0.750937]],"z0":0.02,"z1":0.2},
    {"id":"surface-21","polygon":[[0.791602,0.725521],[0.804036,0.729167],[0.804036,0.7625],[0.791602,0.758854]],"z0":0.02,"z1":0.2},
    {"id":"surface-22","polygon":[[0.804036,0.729167],[0.843099,0.729167],[0.843099,0.7625],[0.804036,0.7625]],"z0":0.02,"z1":0.2}
  ]}]
}
