{"format":"kymaean.hero.method02.stage6m/1","source_artboard":{"width":1536,"height":960},"projection":{"mode":"fixed_orthographic_oblique","depth_dx":0.035,"depth_dy":0.025},"instrumentation":{"base_gray":184,"top_delta":12,"side_delta":-12,"outline_gray":150,"outline_width":0.6},"surface_volumes":[{"id":"shared-surface","solids":[{"id":"top-01","polygon":[[0.0,0.7292],[0.4232,0.7292],[0.4232,0.8583],[0.0,0.8583]],"z0":0.05,"z1":0.16},{"id":"side-01","polygon":[[0.0,0.8583],[0.4232,0.8583],[0.4232,0.8854],[0.0,0.8854]],"z0":0.02,"z1":0.2},{"id":"top-02","polygon":[[0.4232,0.7292],[0.5208,0.7292],[0.5208,0.8583],[0.4232,0.8583]],"z0":0.05,"z1":0.16},{"id":"side-02","polygon":[[0.4232,0.8583],[0.5208,0.8583],[0.5208,0.8854],[0.4232,0.8854]],"z0":0.02,"z1":0.2},{"id":"top-03","polygon":[[0.5208,0.7292],[0.5534,0.7292],[0.5534,0.8583],[0.5208,0.8583]],"z0":0.05,"z1":0.16},{"id":"side-03","polygon":[[0.5208,0.8583],[0.5534,0.8583],[0.5534,0.8854],[0.5208,0.8854]],"z0":0.02,"z1":0.2},{"id":"top-04","polygon":[[0.5534,0.7292],[0.6185,0.7292],[0.6185,0.8583],[0.5534,0.8583]],"z0":0.05,"z1":0.16},{"id":"side-04","polygon":[[0.5534,0.8583],[0.6185,0.8583],[0.6185,0.8854],[0.5534,0.8854]],"z0":0.02,"z1":0.2},{"id":"top-05","polygon":[[0.6185,0.7292],[0.638,0.7292],[0.638,0.8583],[0.6185,0.8583]],"z0":0.05,"z1":0.16},{"id":"side-05","polygon":[[0.6185,0.8583],[0.638,0.8583],[0.638,0.8854],[0.6185,0.8854]],"z0":0.02,"z1":0.2},{"id":"top-06","polygon":[[0.638,0.7292],[0.651,0.7292],[0.651,0.8562],[0.638,0.8583]],"z0":0.05,"z1":0.16},{"id":"side-06","polygon":[[0.638,0.8583],[0.651,0.8562],[0.651,0.8844],[0.638,0.8854]],"z0":0.02,"z1":0.2},{"id":"top-07","polygon":[[0.651,0.7292],[0.6641,0.7292],[0.6641,0.85],[0.651,0.8562]],"z0":0.05,"z1":0.16},{"id":"side-07","polygon":[[0.651,0.8562],[0.6641,0.85],[0.6641,0.8792],[0.651,0.8844]],"z0":0.02,"z1":0.2},{"id":"top-08","polygon":[[0.6641,0.7292],[0.6803,0.7292],[0.6803,0.8396],[0.6641,0.85]],"z0":0.05,"z1":0.16},{"id":"side-08","polygon":[[0.6641,0.85],[0.6803,0.8396],[0.6803,0.8708],[0.6641,0.8792]],"z0":0.02,"z1":0.2},{"id":"top-09","polygon":[[0.6803,0.7292],[0.6934,0.7292],[0.6934,0.8333],[0.6803,0.8396]],"z0":0.05,"z1":0.16},{"id":"side-09","polygon":[[0.6803,0.8396],[0.6934,0.8333],[0.6934,0.8688],[0.6803,0.8708]],"z0":0.02,"z1":0.2},{"id":"top-10","polygon":[[0.6934,0.7292],[0.7064,0.7325],[0.7064,0.8354],[0.6934,0.8333]],"z0":0.05,"z1":0.16},{"id":"side-10","polygon":[[0.6934,0.8333],[0.7064,0.8354],[0.7064,0.8719],[0.6934,0.8688]],"z0":0.02,"z1":0.2},{"id":"top-11","polygon":[[0.7064,0.7325],[0.7096,0.7333],[0.7096,0.8367],[0.7064,0.8354]],"z0":0.05,"z1":0.16},{"id":"side-11","polygon":[[0.7064,0.8354],[0.7096,0.8367],[0.7096,0.8729],[0.7064,0.8719]],"z0":0.02,"z1":0.2},{"id":"top-12","polygon":[[0.7096,0.7333],[0.7227,0.7333],[0.7227,0.8417],[0.7096,0.8367]],"z0":0.05,"z1":0.16},{"id":"side-12","polygon":[[0.7096,0.8367],[0.7227,0.8417],[0.7227,0.8771],[0.7096,0.8729]],"z0":0.02,"z1":0.2},{"id":"top-13","polygon":[[0.7227,0.7333],[0.7292,0.7333],[0.7292,0.8448],[0.7227,0.8417]],"z0":0.05,"z1":0.16},{"id":"side-13","polygon":[[0.7227,0.8417],[0.7292,0.8448],[0.7292,0.8788],[0.7227,0.8771]],"z0":0.02,"z1":0.2},{"id":"top-14","polygon":[[0.7292,0.7333],[0.7422,0.7208],[0.7422,0.851],[0.7292,0.8448]],"z0":0.05,"z1":0.16},{"id":"side-14","polygon":[[0.7292,0.8448],[0.7422,0.851],[0.7422,0.8823],[0.7292,0.8788]],"z0":0.02,"z1":0.2},{"id":"top-15","polygon":[[0.7422,0.7208],[0.7552,0.7083],[0.7552,0.8573],[0.7422,0.851]],"z0":0.05,"z1":0.16},{"id":"side-15","polygon":[[0.7422,0.851],[0.7552,0.8573],[0.7552,0.8854],[0.7422,0.8823]],"z0":0.02,"z1":0.2},{"id":"top-16","polygon":[[0.7552,0.7083],[0.7682,0.7083],[0.7682,0.8583],[0.7552,0.8573]],"z0":0.05,"z1":0.16},{"id":"side-16","polygon":[[0.7552,0.8573],[0.7682,0.8583],[0.7682,0.8854],[0.7552,0.8854]],"z0":0.02,"z1":0.2},{"id":"top-17","polygon":[[0.7682,0.7083],[0.7747,0.7083],[0.7747,0.8583],[0.7682,0.8583]],"z0":0.05,"z1":0.16},{"id":"side-17","polygon":[[0.7682,0.8583],[0.7747,0.8583],[0.7747,0.8854],[0.7682,0.8854]],"z0":0.02,"z1":0.2},{"id":"top-18","polygon":[[0.7747,0.7083],[0.8138,0.7197],[0.8138,0.8583],[0.7747,0.8583]],"z0":0.05,"z1":0.16},{"id":"side-18","polygon":[[0.7747,0.8583],[0.8138,0.8583],[0.8138,0.8854],[0.7747,0.8854]],"z0":0.02,"z1":0.2},{"id":"top-19","polygon":[[0.8138,0.7197],[0.8464,0.7292],[0.8464,0.8583],[0.8138,0.8583]],"z0":0.05,"z1":0.16},{"id":"side-19","polygon":[[0.8138,0.8583],[0.8464,0.8583],[0.8464,0.8854],[0.8138,0.8854]],"z0":0.02,"z1":0.2},{"id":"top-20","polygon":[[0.8464,0.7292],[1.0,0.7292],[1.0,0.8583],[0.8464,0.8583]],"z0":0.05,"z1":0.16},{"id":"side-20","polygon":[[0.8464,0.8583],[1.0,0.8583],[1.0,0.8854],[0.8464,0.8854]],"z0":0.02,"z1":0.2}]}],"proxy_volumes":[{"id":"A","density":"uniform","solids":[{"id":"A-left-foot","polygon":[[0.5208,0.7083],[0.5534,0.7083],[0.5534,0.7292],[0.5208,0.7292]],"support_contact":true,"z0":0.05,"z1":0.16},{"id":"A-right-foot","polygon":[[0.6185,0.7083],[0.651,0.7083],[0.651,0.7292],[0.6185,0.7292]],"support_contact":true,"z0":0.05,"z1":0.16},{"id":"A-left-leg","polygon":[[0.5534,0.5521],[0.5762,0.5521],[0.5534,0.7083],[0.5339,0.7083]],"z0":0.07,"z1":0.15},{"id":"A-right-leg","polygon":[[0.599,0.5521],[0.6217,0.5521],[0.638,0.7083],[0.6185,0.7083]],"z0":0.07,"z1":0.15},{"id":"A-pelvis","polygon":[[0.5501,0.5104],[0.625,0.5104],[0.6217,0.5521],[0.5534,0.5521]],"z0":0.07,"z1":0.15},{"id":"A-torso","polygon":[[0.5501,0.3594],[0.6283,0.3594],[0.6549,0.4271],[0.6549,0.4479],[0.6224,0.5104],[0.5501,0.5104],[0.5378,0.4167]],"z0":0.07,"z1":0.15},{"id":"A-head","polygon":[[0.5924,0.2031],[0.5794,0.2188],[0.5697,0.2917],[0.5762,0.3594],[0.6152,0.3594],[0.6296,0.2552],[0.625,0.2292],[0.612,0.2031]],"z0":0.08,"z1":0.14}]},{"id":"B","density":"uniform","solids":[{"id":"B-left-foot","polygon":[[0.7096,0.7188],[0.7292,0.7188],[0.7292,0.7333],[0.7096,0.7333]],"support_contact":true,"z0":0.05,"z1":0.16},{"id":"B-right-foot","polygon":[[0.7552,0.6937],[0.7747,0.6937],[0.7747,0.7083],[0.7552,0.7083]],"support_contact":true,"z0":0.05,"z1":0.16},{"id":"B-left-leg","polygon":[[0.6803,0.5521],[0.6934,0.5521],[0.7227,0.7188],[0.7129,0.7188]],"z0":0.07,"z1":0.15},{"id":"B-right-leg","polygon":[[0.6934,0.5521],[0.707,0.5521],[0.7682,0.6937],[0.7552,0.6937]],"z0":0.07,"z1":0.15},{"id":"B-pelvis","polygon":[[0.6608,0.5104],[0.7005,0.5104],[0.707,0.5521],[0.6803,0.5521]],"z0":0.07,"z1":0.15},{"id":"B-upper-torso","polygon":[[0.6549,0.4271],[0.6706,0.3594],[0.6966,0.3594],[0.6934,0.4479],[0.6549,0.4479]],"z0":0.07,"z1":0.15},{"id":"B-lower-torso","polygon":[[0.6549,0.4479],[0.6934,0.4479],[0.7005,0.5104],[0.6608,0.5104]],"z0":0.07,"z1":0.15},{"id":"B-head","polygon":[[0.6706,0.3594],[0.6641,0.3125],[0.6634,0.2604],[0.6673,0.2292],[0.6771,0.2083],[0.6966,0.2083],[0.7096,0.2344],[0.7129,0.2604],[0.7064,0.3021],[0.6966,0.3594]],"z0":0.08,"z1":0.14}]}],"contacts":[{"id":"contact-AB","a":"A","b":"B","point_a":[0.6549,0.4375,0.11],"point_b":[0.6549,0.4375,0.11],"axis":"horizontal_x"}],"static_cases":[{"id":"A-unsupported","kind":"unsupported","proxy":"A","expected":"stable","minimum_margin":0.05,"contact_id":null,"target_cop_x":null,"counterparty":null},{"id":"B-unsupported","kind":"unsupported","proxy":"B","expected":"unstable","minimum_margin":0.0162,"contact_id":null,"target_cop_x":null,"counterparty":null},{"id":"B-supported-by-A","kind":"supported_pair","proxy":"B","expected":"stable","minimum_margin":0.0032,"contact_id":"contact-AB","target_cop_x":0.7129,"counterparty":"A"}],"sanitization":{"allow_guides":false,"allow_ids":false,"allow_metadata":false,"allow_text":false,"transparent_background":true},"review":{"maquette_leakage":"PASS","surface_read":"PASS","transfer_eligible":true}}